{
  "$schema": "https://json-schema.org/draft/2020-12/schema",
  "$id": "defense-factory://finding-discovery/findings.schema.json",
  "title": "Defense Factory stage 2 findings record (findings.json)",
  "description": "Written by the agent, normalized by normalize_findings.py (which adds id, fingerprint, end_line, and hypothesis_priority), checked by check_findings.py, and rendered to findings.md by render_findings.py. Every finding is unvalidated.",
  "type": "object",
  "properties": {
    "record": { "$ref": "#/$defs/record" },
    "threat_model": {
      "description": "The stage 1 model this run started from; null for a narrow scan.",
      "anyOf": [{ "type": "null" }, { "$ref": "#/$defs/threatModelRef" }]
    },
    "seeds": { "type": "array", "items": { "$ref": "#/$defs/seed" } },
    "findings": { "type": "array", "items": { "$ref": "#/$defs/finding" } },
    "reconciliation": { "type": "array", "items": { "$ref": "#/$defs/reconciliationRow" } },
    "stage1_open_questions": { "type": "array", "items": { "$ref": "#/$defs/carriedQuestion" } },
    "coverage": { "$ref": "#/$defs/coverage" },
    "open_questions": { "type": "array", "items": { "$ref": "#/$defs/text" } }
  },
  "required": ["record", "threat_model", "seeds", "findings", "reconciliation", "stage1_open_questions", "coverage", "open_questions"],
  "additionalProperties": false,
  "$defs": {
    "text": { "type": "string", "pattern": "\\S" },
    "textList": { "type": "array", "items": { "$ref": "#/$defs/text" } },
    "hypothesisOrSeed": { "type": "string", "pattern": "^(TM-H[1-9][0-9]*|SEED-[1-9][0-9]*)$" },
    "findingRef": {
      "description": "A finding's key, or its FD id once normalized. normalize_findings.py rewrites every reference to the FD id.",
      "type": "string",
      "pattern": "^([a-z0-9][a-z0-9._-]*|FD-[1-9][0-9]*)$"
    },
    "location": {
      "type": "object",
      "properties": {
        "path": { "type": "string", "pattern": "\\S", "description": "Relative to the repository root." },
        "start_line": { "type": "integer", "minimum": 1 },
        "end_line": { "type": "integer", "minimum": 1, "description": "Defaults to start_line." },
        "role": { "enum": ["entrypoint", "source", "root_control", "sink", "concrete_implementation", "evidence"] }
      },
      "required": ["path", "start_line", "role"],
      "additionalProperties": false
    },
    "record": {
      "type": "object",
      "properties": {
        "record_version": { "const": 1 },
        "stage": { "const": "2-finding-discovery" },
        "status": { "enum": ["complete", "inconclusive", "blocked"] },
        "run_id": { "type": "string", "pattern": "^[A-Za-z0-9._-]+$" },
        "timestamp": { "type": "string", "pattern": "^\\d{4}-\\d{2}-\\d{2}T\\d{2}:\\d{2}:\\d{2}Z$" },
        "actor": { "$ref": "#/$defs/text" },
        "model": { "$ref": "#/$defs/text" },
        "skill_version": { "type": "string", "pattern": "^finding-discovery/sha256:[0-9a-f]{16}$" },
        "target_id": { "$ref": "#/$defs/text" },
        "target_kind": { "enum": ["git_revision", "git_worktree", "directory_snapshot"] },
        "version": { "$ref": "#/$defs/text" },
        "revision": { "anyOf": [{ "type": "null" }, { "$ref": "#/$defs/text" }] },
        "scope": {
          "anyOf": [
            { "const": "whole-repository" },
            { "type": "array", "minItems": 1, "uniqueItems": true, "items": { "$ref": "#/$defs/text" } }
          ]
        },
        "authorization": { "$ref": "#/$defs/text" },
        "output_location": { "$ref": "#/$defs/text" },
        "source": { "enum": ["stage-1-record", "narrow-scan"] },
        "inputs": { "$ref": "#/$defs/textList" },
        "independent_baseline": { "type": "string", "pattern": "^(independent|not-independent|not-performed: \\S.*)$" },
        "tools": { "$ref": "#/$defs/text" },
        "evidence": { "$ref": "#/$defs/text" },
        "assumptions": { "$ref": "#/$defs/textList" },
        "coverage_gaps": { "$ref": "#/$defs/textList" },
        "next_action": { "$ref": "#/$defs/text" }
      },
      "required": [
        "record_version", "stage", "status", "run_id", "timestamp", "actor", "model", "skill_version",
        "target_id", "target_kind", "version", "revision", "scope", "authorization", "output_location",
        "source", "inputs", "independent_baseline", "tools", "evidence", "assumptions", "coverage_gaps",
        "next_action"
      ],
      "additionalProperties": false
    },
    "threatModelRef": {
      "type": "object",
      "properties": {
        "path": { "type": "string", "pattern": "\\S", "description": "Relative to the folder holding findings.json, normally ../1-threat-model/threat-model.md." },
        "sha256": { "type": "string", "pattern": "^[0-9a-f]{64}$" },
        "run_id": { "type": "string", "pattern": "^[A-Za-z0-9._-]+$" }
      },
      "required": ["path", "sha256", "run_id"],
      "additionalProperties": false
    },
    "seed": {
      "type": "object",
      "properties": {
        "id": { "type": "string", "pattern": "^SEED-[1-9][0-9]*$" },
        "kind": { "enum": ["advisory", "scanner", "report", "other"] },
        "label": { "$ref": "#/$defs/text" },
        "summary": { "$ref": "#/$defs/text" },
        "locations": { "type": "array", "items": { "$ref": "#/$defs/location" } }
      },
      "required": ["id", "kind", "label", "summary"],
      "additionalProperties": false
    },
    "finding": {
      "type": "object",
      "properties": {
        "key": { "type": "string", "pattern": "^[a-z0-9][a-z0-9._-]*$", "description": "The agent's own stable label; never an FD id." },
        "id": { "type": "string", "pattern": "^FD-[1-9][0-9]*$" },
        "fingerprint": { "type": "string", "pattern": "^fp:[0-9a-f]{16}$" },
        "title": { "$ref": "#/$defs/text" },
        "family": { "type": "string", "pattern": "^[a-z0-9]+(-[a-z0-9]+)*\\.[a-z0-9]+([.-][a-z0-9]+)*$" },
        "instance": { "type": "string", "pattern": "^[a-z0-9][a-z0-9._-]*$" },
        "cwe_ids": { "type": "array", "items": { "type": "string", "pattern": "^[Cc][Ww][Ee]-0*[1-9][0-9]*$" } },
        "origin": {
          "type": "array",
          "minItems": 1,
          "uniqueItems": true,
          "items": { "type": "string", "pattern": "^(TM-H[1-9][0-9]*|SEED-[1-9][0-9]*|open-ended)$" }
        },
        "discovered_by": {
          "description": "Every auditor that found it independently: more than one is corroboration.",
          "type": "array",
          "minItems": 1,
          "uniqueItems": true,
          "items": { "enum": ["baseline", "investigator", "parent"] }
        },
        "locations": { "type": "array", "minItems": 1, "items": { "$ref": "#/$defs/location" } },
        "attacker": { "$ref": "#/$defs/text" },
        "source": { "$ref": "#/$defs/text" },
        "control": { "$ref": "#/$defs/text" },
        "sink": { "$ref": "#/$defs/text" },
        "path": { "$ref": "#/$defs/text" },
        "impact": { "$ref": "#/$defs/text" },
        "exposure_assumptions": { "$ref": "#/$defs/textList" },
        "counterevidence": { "$ref": "#/$defs/text" },
        "proof_gaps": { "$ref": "#/$defs/textList" },
        "investigation_question": { "$ref": "#/$defs/text" },
        "confidence": {
          "type": "object",
          "properties": {
            "level": { "enum": ["High", "Medium", "Low"] },
            "reason": { "$ref": "#/$defs/text" }
          },
          "required": ["level", "reason"],
          "additionalProperties": false
        },
        "hypothesis_priority": { "anyOf": [{ "type": "null" }, { "enum": ["Critical", "High", "Medium", "Low"] }] },
        "merged_from": { "type": "array", "uniqueItems": true, "items": { "type": "string", "pattern": "^[a-z0-9][a-z0-9._-]*$" } },
        "related": { "type": "array", "uniqueItems": true, "items": { "$ref": "#/$defs/findingRef" } },
        "excerpt": { "$ref": "#/$defs/text" },
        "status": { "const": "unvalidated" }
      },
      "required": [
        "key", "title", "family", "cwe_ids", "origin", "discovered_by", "locations", "attacker", "source",
        "control", "sink", "path", "impact", "exposure_assumptions", "counterevidence", "proof_gaps",
        "investigation_question", "confidence", "status"
      ],
      "additionalProperties": false
    },
    "reconciliationRow": {
      "type": "object",
      "properties": {
        "ref": { "$ref": "#/$defs/hypothesisOrSeed" },
        "disposition": { "enum": ["findings", "no-finding", "open-question", "not-investigated"] },
        "findings": { "type": "array", "uniqueItems": true, "items": { "$ref": "#/$defs/findingRef" } },
        "note": { "$ref": "#/$defs/text" },
        "evidence": { "type": "array", "items": { "$ref": "#/$defs/location" } }
      },
      "required": ["ref", "disposition", "note"],
      "additionalProperties": false
    },
    "carriedQuestion": {
      "type": "object",
      "properties": {
        "number": { "type": "integer", "minimum": 1 },
        "status": { "enum": ["answered", "open"] },
        "note": { "$ref": "#/$defs/text" }
      },
      "required": ["number", "status", "note"],
      "additionalProperties": false
    },
    "coverage": {
      "type": "object",
      "properties": {
        "inventory": { "type": "string", "pattern": "\\S", "description": "Relative to the folder holding findings.json, normally scope-inventory.txt." },
        "reviewed_files": { "type": "array", "uniqueItems": true, "items": { "$ref": "#/$defs/text" } },
        "completeness": { "enum": ["complete", "partial"] },
        "remaining": {
          "type": "array",
          "items": {
            "type": "object",
            "properties": {
              "paths": { "type": "array", "minItems": 1, "items": { "$ref": "#/$defs/text" } },
              "reason": { "$ref": "#/$defs/text" }
            },
            "required": ["paths", "reason"],
            "additionalProperties": false
          }
        },
        "exclusions": {
          "type": "array",
          "items": {
            "type": "object",
            "properties": {
              "pattern": { "$ref": "#/$defs/text" },
              "reason": { "$ref": "#/$defs/text" }
            },
            "required": ["pattern", "reason"],
            "additionalProperties": false
          }
        }
      },
      "required": ["inventory", "reviewed_files", "completeness", "remaining", "exclusions"],
      "additionalProperties": false
    }
  }
}
